-250000:Resten van kamp van jager-verzamelaars in de Belvedere-groeve bij Maastricht; oudste menselijke (neanderthaler) sporen in Nederland bestaande uit stenen werktuigen en dierenbotten.
-200000:Bij Rhenen zijn stenen gevonden die bewerkt zijn volgens de Levalloistechniek.
-150000:Tijdens het Saalien, het op een na laatste glaciaal, wordt in Nederland een toendraklimaat regelmatig afgewisseld met een ijsklimaat, waardoor bewoning vaak niet mogelijk is.
-12000:De temperatuur begint te stijgen, waardoor bewoning tijdens het Holoceen weer mogelijk wordt. Sporen van de Hamburgcultuur zijn gevonden in Friesland en Drenthe.
-10000:In de buurt van Sint Odilienberg is de oudste tekening van Nederland gevonden.
-9500:De zeespiegel staat in het begin van het Holoceen nog zo laag dat een groot deel van het Noordzeebekken droog ligt, waarbij de kustlijn noordelijk ligt van de huidige Doggersbank en Engeland nog verbonden is met het vasteland.
-9000:Sporen van de Ahrensburgcultuur zijn in Noord-Brabant gevonden, de eersten die pijl-en-boog gebruiken.
-7900:In 1955 wordt de Kano van Pesse gevonden, een uitgeholde boomstam, die zich thans in het Drents Museum in Assen bevindt.
-7000:In het Vroeg-Atlanticum staat de zeespiegel op ca. -20 m NAP en komt de kustlijn in de buurt van de huidige. De stuwwallen van het Texel-IJsselmeer Hoog en het Groningen Hoog steken uit als landtongen.
-7000:Reconstructie van Trijntje in het Rijksmuseum van Oudheden, Leiden (ca 5500 v.Chr.)
-5500:Trijntje is de naam die gegeven werd aan het oudste menselijke skelet dat in Nederland is aangetroffen te Hardinxveld-Giessendam. De restanten uit de Swifterbantcultuur en een reconstructie bevinden zich in het Rijksmuseum van Oudheden in Leiden.
-5300:De volkeren van de bandkeramische cultuur vestigen zich op de hogere, vruchtbare lossgronden van Zuid-Limburg en vormen daarmee de eerste landbouwers in Nederland, waarmee hier het Neolithicum begint. Vooral in Elsloo zijn veel vondsten uit deze periode gedaan. Na zo'n 700 jaar verdwijnt deze cultuur om nog niet bekende redenen.
-4900:Boven de rivieren is een cultuur van jager-verzamelaars te vinden, waaruit zich de Swifterbantcultuur ontwikkelt.
-4450:In 1968 wordt bij de aanleg van de Deltawerken in een veenlaag op 8 meter diepte het Mannetje van Willemstad gevonden.
-4250:In Zuid-Nederland worden sporen gevonden van de Michelsbergcultuur.
-4000:Tijdens het Subboreaal sluit de westkust zich steeds meer, met als gevolg dat de achterliggende lagune verzoet, wat grootschalige veenvorming in de hand werkt.
-4000:Vuursteenmijnen van Rijckholt (ca 3950-2650 v.Chr.)
-3900:In het Savelsbos bij het Limburgse dorp Rijckholt worden de vuursteenmijnen van Rijckholt in gebruik genomen, de oudste bekende mijnen van Europa. In een groot aantal kleinschalige mijnen wordt gedurende een periode van meer dan 1000 jaar zo'n 40.000 ton vuursteen gewonnen, dat naar grote delen van Europa wordt geexporteerd. Enkele eeuwen jonger zijn de vuursteenmijnen van Valkenburg.
-3900:Hunebed D14 te Eext, Drenthe (ca 3450-3250 v.Chr.)
-3450:In Drenthe en andere delen van Nederland zijn de hunebedden indrukwekkende overblijfselen van de Trechterbekercultuur; in Friesland vindt terpbewoning plaats; in de duingebieden van West-Nederland zijn overblijfselen gevonden van de Vlaardingencultuur.
-3250:De leden van de standvoetbekercultuur maken gebruik van karren.
-3250:Grafkelder van Stein (ca 3000 v.Chr.)
-3000:In het Archeologiemuseum Stein in Stein (Limburg) bevindt zich de neolithische grafkelder van Stein van de Seine-Oise-Marne-cultuur met crematieresten van ongeveer 35 mensen, potscherven en vuurstenen pijlpunten.
-2600:Naast en uit de standvoetbekercultuur ontstaat de klokbekercultuur, hiermee begint een tijd van intensieve contacten overzee, wat verklaart waarom de prehistorische culturen van Nederland en Engeland aan weerszijden van de Noordzee altijd zoveel met elkaar gemeen hebben. Ze bereiken zelfs Noord-Afrika.
-2100:De Bronstijd zorgt in Nederland niet direct tot nieuwe culturen, maar wel tot meer specialisatie. De handel wordt in deze tijd belangrijker. Bij Wageningen zijn uit deze tijd een hellebaard, bijl, mes en armband gevonden.
-1900:In 1953 wordt in het veen de bronzen dolk van Barger-Oosterveld gevonden.
-1800:De Hilversumcultuur verspreidt zich van Midden-Nederland tot Calais en duurt tot ca. 1200 v.Chr.
-1800:Het bronzen zwaard van Jutphaas is een van de vijf bijna identieke zwaarden die in Bretagne, Bourgondie, Zuid-Engeland en Nederland zijn gevonden. Deze dienden niet voor de strijd, maar om de status van de eigenaar te benadrukken.
-1300:In heel Europa ontstaat vrij plotseling de urnenveldencultuur doordat men overstapt op crematie, mogelijk door nieuwe religieuze inzichten. Op de Boshoverheide bevindt zich het grootste teruggevonden urnenveld.
-1300:In het skelet van de Krabbeplasman is het oudste menselijke DNA aangetroffen dat ooit in Nederland is gevonden.
-1300:Replica van het tempeltje van Barger-Oosterveld in het Drents Museum (ca 1250 v.Chr.)
-1250:Het tempeltje van Barger-Oosterveld speelt een rol bij rituelen in het veen.
-1200:In 1938 wordt bij Emmer-Erfscheidenveen het oudste veenlijk van Nederland gevonden, waarschijnlijk een mensenoffer.
-1150:In 1961 wordt bij Barger-Oosterveld een ijzeren pennetje van vier centimeter gevonden. Het zal echter nog lang duren voordat ijzer op grote schaal gebruikt wordt.
-1150:Hallstatt-armbanden.
-750:Bij Wijchen zijn resten gevonden van een vierwielig pronkwagen. In Zuid-Nederland neemt de vroeg-Keltische Hallstatt-cultuur de plaats in van de urnenveldencultuur.
-700:In Friesland en Groningen worden de eerste wierden aangelegd, in Friesland terpen genoemd.
-650:Het zuiden van Nederland komt onder de invloed van de La Tene-periode. Krijgsgeweld neemt toe.
-450:De munt doet geleidelijk zijn intrede.
-350:In 1818 wordt de Valtherbrug gevonden, een veenweg tussen Ter Apel en Valthe.
-150:De Germanen dringen op en verdrijven langzaam de Kelten.
-55:Julius Caesar komt min of meer door toeval in Nederland terecht tijdens de Gallische Oorlog, waarbij hij de Usipeti en Tencteren vrijwel uitroeit. Met zijn Commentarii Rerum in Gallia Gestarum maakt hij een einde aan de prehistorie in Nederland, al zijn geschreven bronnen na de Romeinen schaars en zou een deel van de Middeleeuwen in Nederland in die zin als prehistorie opgevat kunnen worden.
-27:Octavianus wordt princeps. De Bataven wonen in het rivierengebied, terwijl de Cananefaten zich westelijk van hen hebben gevestigd. In Overijssel bevinden zich de Chamaven, in het noorden de Frisii. Zij worden beschreven door Tacitus in zijn Germania.
-12:Drusus sluit een verdrag met de Bataven en de Cananefaten, zodat hun gebied deel uitmaakt van Gallia Belgica. Op het Insula Batavorum (Bataveneiland) wordt een groot legerkamp gebouwd. Later zal hier vlak bij een aantal nederzettingen gesticht worden die bij elkaar Oppidum Batavorum genoemd worden, mogelijk het latere Noviomagus.
-9:De Romeinse veldheer Drusus verslaat, volgens de latere geschiedschrijver Cassius Dio met behulp van de Friezen, de Chauken bij de Eemsmonding. Hij laat de Drususgracht en Drususdam aanleggen en heeft zijn hoofdkwartier op het Kops Plateau ten oosten van het huidige Nijmegen. Drusus overlijdt na een succesvolle veldtocht ergens langs de Lippe ten gevolge van een val van zijn paard.
-9:Model Romeinse brug van Maastricht en wegprofiel Via Belgica (Thermenmuseum, Heerlen)
0:De Romeinen leggen de belangrijke oost-westverbinding tussen Colonia Claudia Ara Agrippinensium (Keulen) en Gesoriacum (Boulogne sur Mer) aan, de latere Via Belgica. Bij de Romeinse brug over de Maas ontstaat de nederzetting Mosa Trajectum (Maastricht) met onder andere een tempel- en badhuiscomplex.
0:Het is niet duidelijk of veenlijken, zoals het meisje van Yde en het paar van Weerdinge, het gevolg zijn van mensenoffers of van de Germaanse rechtspraak.
4:Princeps Augustus zegt toe dat Tiberius, de oudere broer van Drusus, zijn opvolger is. Deze heeft de veldtochten van zijn broer voortgezet, waardoor het gebied tussen de Rijn en de Elbe nu in handen is van de Romeinen.
4:In 1996 wordt bij Vlaardingen een boemerang gevonden, waarschijnlijk van een Cananefaat.
8:Tiberius verslaat een stam Sugambren en deporteert ze gedeeltelijk naar de noordelijke Rijnoever.
9:De Frisii, Bataven en Cananefaten komen niet in opstand na de Romeinse nederlaag in de Slag bij het Teutoburgerwoud tegen Arminius.
14:Nadat Augustus overlijdt, breken er onlusten uit onder de Romeinse troepen. Germanicus weet deze te bezweren en de twee jaar daarna besteedt hij aan veldtochten tegen Arminius, geholpen door zijn Bataafse cohorten. Keizer Tiberius geeft Germanicus uiteindelijk in 16 opdracht de strijd in Germanie op te geven. De Bataven dienen ook als de lijfwacht, corporis custos van onder andere Tiberius en de latere Nero.
14:De Nijmeegse godenpijler in Museum Het Valkhof
15:De oprichting van de Nijmeegse godenpijler markeert de pacificatie van Germanie en het begin van de Pax Romana ("Romeinse vrede") in een groot deel van Nederland.
28:Nadat Olennius onredelijke belastingen eist, komen de Friezen in Noord-Nederland in opstand. Tijdens de Slag van Baduhenna lijden de Romeinen een nederlaag, waarna Olennius zich terugtrekt in het castellum Flevum. De opstand veroorzaakt paniek tot in Noviomagus. Dat weten we omdat iemand zijn geld in allerijl begroef en het nooit weer heeft gevonden.
29:De Tolsumer Akte is de oudste bewaarde geschreven tekst van Nederland.
47:Corbulo brengt de vloot van de Chauken tot zinken. Dezen plunderen onder de Cananefatische oud-legionair Gannascus de kust van Germania Inferior en Gallia Belgica. De Rijn wordt door Claudius als limes vastgesteld, hoewel de Frisii onder Romeins bestuur blijven. De rivier geldt zowel als scheidingslijn tussen de gebieden, als bindend element, doordat deze transport en communicatie vereenvoudigt.
47:Claudius verbiedt verdere veldtochten tegen de Germanen, omdat hij de prioriteit geeft aan de invasie van Britannia. Corbulo laat dan maar het kanaal van Corbulo graven, een verbinding van het huidige Naaldwijk en het huidige Leiden tussen de toenmalige Maas en de toenmalige Rijn (de huidige Oude Rijn).
58:De Friese aanvoerders Malorix en Verritus worden Romeins staatsburger, maar moeten het stuk grond ten zuiden van de Rijn dat zij bezet hebben verlaten.
69:Door het machtsvacuum van het Vierkeizerjaar na de dood van Nero wordt de Bataafse Opstand mogelijk onder leiding van Julius Civilis. Alle Romeinse vestingen en vestigingen in Germania Inferior en Gallia Belgica gaan in vlammen op, inclusief Oppidum Batavorum en Tongeren. Het jaar daarop wordt de opstand neergeslagen.
69:Na de Batavenopstand onder Julius Claudius Civilis verblijft te Noviomagus (Nijmegen) een legioen Romeinen bestaande uit tussen 4200 en 6000 militairen waaronder 300 ruiters.
78:Onder Gnaeus Julius Agricola dienen Bataven in Britannia met eigen bevelhebbers, maar ook in Noricum en Raetia.
80:Het Germaanse gebied van het Romeinse Rijk wordt in 2 deelgebieden georganiseerd (z.g. provinciae) : "Germania superior" (Oost-Europa & Nabije Oosten) en "Germania inferior" (De Lage Landen, Frankrijk & Duitsland).
80:Romeins badhuis te Coriovallum (Heerlen)
100:De nederzetting Coriovallum (Heerlen) op het kruispunt van twee Romeinse heirbanen ontwikkelt zich tot een relatief grote stad. De ruine van het Romeinse badhuis, bewaard in het Thermenmuseum, is het grootste Romeinse monument in Nederland.
121:Hadrianus bezoekt Germania Inferior en verleent marktrechten aan de belangrijkste plaats van de Cananefaten (een deel van het huidige Voorburg), waarna de plaats Forum Hadriani gaat heten. Noviomagus wordt waarschijnlijk een municipium.
160:Ook Forum Hadriani wordt een municipium.
167:De Friese ruiters van het Cuneus Frisionum worden ingezet in Britannia.
167:De Chauken trekken plunderend rond, wat de reden is dat uit deze tijd veel muntschatten gevonden worden die om die reden begraven worden.
175225:De Sarcofaag van Simpelveld - eigenlijk een askist - is aan de binnenkant in relief gebeeldhouwd, bestaande uit een liggende vrouw met het interieur van haar huis.
175225:Domburgs Nehalennia-altaar
200:In 1970 vindt een visser delen van een Nehalennia-altaar in zijn netten, terwijl hij bij Colijnsplaat aan het vissen is. Later vindt hij circa 200 votiefstenen en resten van een Romeins bouwwerk. Bij Domburg waren al in 1647 resten van een Nehalennia-tempel gevonden.
212:Door de Constitutio Antoniniana krijgen alle vrije burgers in de provincies het Romeinse burgerrecht, waardoor keizer Caracalla meer belastingen kan innen.
235:Keizer Severus Alexander wordt vermoord, waarna de crisis van de 3e eeuw volgt waarin de ene soldatenkeizer de andere opvolgt, vaak met geweld. Hierdoor verdwijnt de invloed van het centrale Romeinse gezag in Germania Inferior. De crisis eindigt pas in 284, als Diocletianus aan de macht komt.
240:De Franken worden voor het eerst genoemd als zij zich in het Rijk willen vestigen en de Rijn oversteken, waarna ze plunderend door Gallie trekken. Ze worden echter bij Mainz verslagen, waarna ze zich aan de oostoever vestigen.
250:Kusterosie zorgt ervoor dat het water komt tot aan het castellum van Oudenburg, waarschijnlijk Portus Epiatici. Ook Brittenburg, de meest westelijke Romeinse fortificatie aan de Oude Rijn, komt onder water te staan. De Romeinen kunnen de strijd tegen het water niet winnen en verlaten het gebied.
258:Door het heersende machtsvacuum kan onder Postumus het Gallische keizerrijk ontstaan naast het echte Romeinse Rijk. Postumus weet de tot in Spanje doorgedrongen Franken te verslaan en bestrijdt de Frankische zeerovers bij de Nederlandse kust.
258:De Tabula Peutingeriana is een kopie van een Romeinse reiskaart uit de 3e tot 4e eeuw
270:Na de dood van Postumus weten de Franken zich toch over de Rijn te vestigen, waarmee een einde komt aan de romanisering.
295:Keizer Constantius I Chlorus onderwerpt de Franken en brengt een deel van hen over naar Noord-Frankrijk. De Salische Franken beschermen nu de grens tegen andere Germanen.
350:Nadat Constantijn de Grote in 312 bekeerd is tot het christendom verspreidt deze godsdienst zich versneld over het hele Romeinse rijk. Ook in Nederland zijn al christenen.
358:Julianus de Afvallige staat de Salische Franken toe zich te vestigen in Toxandrie als foederati.
358:Dood van Sint-Servaas in 384 te Maastricht. Engelen bedekken zijn lichaam met 'hemelse doeken'
384:Servaas van Maastricht, bisschop van Tongeren verplaatst volgens de overlevering de bisschopszetel naar Maastricht en overlijdt aldaar.
402:Stilicho roept de Romeinse troepen terug van de grensgebieden om Italie te verdedigen tegen de Goten. De meeste steden en Romeinse villa's worden verlaten; Maastricht blijft door de aanwezigheid van de bisschopszetel bewoond.
406:Tijdens de Slag bij Mainz worden de Ripuarische Franken verslagen door de voor de Hunnen vluchtende Vandalen, Sueven, Alanen, Alemannen en de Bourgondiers die daarna de Rijn oversteken.
451:In de buurt van Troyes, het Campus Mauriacus komt een geallieerd leger van de visigotische koning Theodorik en de Romeinse veldheer Aetius in strijd met de Hunnen. Na de Slag op de Catalaunische velden is het gevaar van de Hunnen geweken.
476:Romulus Augustulus, de laatste keizer van het West-Romeinse Rijk, wordt afgezet door Odoaker. Deze biedt aan de Oost-Romeinse keizer Zeno de westelijke keizerskroon aan.
481:Het graf van Childerik I in Doornik wordt in 1653 ontdekt, en geldt als het rijkste Frankische koningsgraf dat ooit is gevonden. Hij vecht enkele malen aan de zijde van de Romeinen, onder meer met Aegidius tegen de Visigoten bij Orleans in 463 en met comes Paulus tegen de Angelsaksen in Angers in 464.
481:Vroeg-christelijke grafstenen, 5e-6e eeuw, het oudste, tastbare bewijs van christendom in Nederland (oostcrypte St-Servaaskerk, Maastricht)
496:Clovis I, koning der Franken, laat zich dopen, waarna de Franken in groten getale overgaan naar het christelijke geloof.
525:Een Friese koning van wie de naam niet is overgeleverd, verslaat tijdens de Slag aan de Rijn met zijn leger de Deense dan wel Zweedse indringers, die worden aangevoerd door koning Hygelac.
560:Chlotarius I verovert een deel van Friesland. Volgens de Frankische gewoonte is zijn rijk echter een persoonlijk gebied en wordt als zodanig bij zijn dood onder zijn zonen verdeeld. Vaak ontstaan door de rivaliteit onderlinge oorlogen, wat zorgt voor een machtsvacuum in de randgebieden. Hierdoor kunnen de Friezen meermalen gebieden heroveren.
600:Dorestad komt tot bloei door de handel tussen de Chamaven van Hamaland, de Friezen en de Franken en met Scandinavie en Engeland.
630:Na een periode van interne strijd in Frankrijk, waardoor de Frankische invloed in Nederland vrijwel verdwijnt, komt Dagobert I met een klein leger naar het noorden. In Utrecht wordt een kerkje gesticht. Na het overlijden van Dagobert volgt weer een periode van neergang van de Frankische macht en vervalt het kerkje.
633:Sint Amandus, de latere bisschop van Maastricht, wordt daar door de paus tot missiebisschop voor Friesland en de Saksen gewijd. Hij richt diverse kloosters en kerken op, zoals de Sint-Pieterskerk en de Sint-Baafsabdij in Gent en het klooster van Elnone of Elonon, waar hij overlijdt.
650:De Romeinse keerploeg keert weer terug om langzaam het eergetouw te vervangen, waardoor het land beter bewerkt kan worden en opbrengsten groter worden.
689:De Frankische hofmeier Pepijn II van Herstal wint de Slag bij Dorestad en verovert zo het gebied ten zuiden van de Oude Rijn op de Friezen onder Radbod. Ter bezegeling van de nieuwe verhoudingen trouwt de zoon van Pepijn, Grimoald II, met Theudesinde, de dochter van Radbod.
689:Willibrord zet zich in voor de kerstening van de Friezen
695:Willibrord wordt door paus Sergius I tot aartsbisschop der Friezen gewijd, met Utrecht als zijn zetel.
714:Pepijn van Herstal overlijdt, waarna een opvolgingsstrijd uitbarst. Radbod maakt hiervan gebruik en weet in 716 Karel Martel te verslaan in de Slag bij Keulen. Radbod overlijdt in 719 en rond 720 weet Karel - de winnaar van de successiestrijd - het Frankische gezag rond Utrecht te herstellen.
714:Willibrord sticht op het door Pepijn van Herstal en zijn echtgenote Plectrudis geschonken landgoed Suestra de abdij van Susteren, waarschijnlijk de oudste abdijstichting in Nederland.
734:Poppo van de Friezen wordt verslagen door Karel Martel in de Slag aan de Boorne.
750:De Utrechtse Doopgelofte is een van de weinige overgebleven voorbeelden van Oudnederlands.
754:De bisschop van Mainz, Bonifatius, wordt met zijn gevolg gedood in Friesland.
768:Karel de Grote en diens broer Carloman worden koning van het Frankische rijk. Carloman sterft op 5 december 771, waarna Karel koning wordt van het gehele Frankische rijk. Hij weet dit tijdens zijn heerschappij enorm uit te breiden. Alle vrije inwoners moeten een eed van trouw aan hem zweren, waardoor hij meer macht heeft dan zijn voorgangers.
772:De Saksen steken de kerk van Lebuinus in Deventer in brand nadat de Franken de Irminsul op de belangrijkste verzamelplaats van de Saksen vernietigen. Daarop onderneemt Karel een strafexpeditie. De Saksenoorlogen duren in het huidige Duitsland tot 804, maar eindigen in de Nederlanden als Widukind zich in 785 laat dopen met Karel de Grote als peter. De Franken kerstenen de Saksen met veel geweld, op het beoefenen van heidense rituelen staat de doodstraf.
790:Liudger geneest volgens overlevering in Helwerd de blinde Friese dichter Bernlef, die daarna overgaat tot het christendom.
800:Karel de Grote wordt tot keizer gekroond.
802:De Ewa quae se ad Amorem habet is de eerste wettekst die het heeft over een waterkering (sclusam, sluis) in het gebied van de Nederlanden.
810:Godfried van Denemarken valt met 200 schepen Friesland aan als vergelding voor de pogingen van Karel de Grote om Denemarken bij zijn rijk te voegen, na daarvoor al de Danevirk versterkt te hebben. De Deense vorst wordt dat jaar vermoord door een van zijn Huskarls. Als verdediging tegen de aanvallen van de Vikingen laat Karel de Grote vlooteenheden plaatsen in Boulogne en Gent en maakt Friesland - wat in deze tijd strekt van Sincfala tot de Wezer - een mark met de verplichting tot permanente paraatheid.
814:Karel overlijdt en wordt opgevolgd door zijn enige nog levende zoon, Lodewijk de Vrome, waardoor het wederopgestane "West-Romeinse Rijk" nog een generatie lang ongedeeld blijft. Dit is een vrij zeldzame situatie, aangezien het Frankisch recht vereist dat het rijk verdeeld wordt onder de nog levende zonen, wat vaak voor onderlinge strijd en verdeeldheid zorgt.
814:De Einhardsboog, een geschenk van Einhard aan de Sint-Servaaskerk
820:Karel de Grote's biograaf Einhard trekt zich terug van het hof te Aken en wordt lekenabt van het Sint-Servaasklooster te Maastricht. Hij schenkt de kerk belangrijke relieken, de zogenaamde Einhardsboog en waarschijnlijk ook de Sleutel van Sint-Servaas, waardoor de status van de kerk zeer toeneemt.
826:Harald Klak wordt door Lodewijk de Vrome beleend met de Friese gouw Rustringen, tegenwoordig grotendeels deel van de Jadeboezem door stormvloeden.
834:Vikingen plunderen Dorestad en Quentovic tot 837. Dorestad, dat nu een van de belangrijkste en succesvolste handelssteden in Noordwest-Europa is, weet zich steeds te herstellen, maar vervalt uiteindelijk, waarschijnlijk door verzanding van de Kromme Rijn.
838:Bij de stormvloed van 838 raakt een groot deel van Noordwest-Nederland onder water. De Lek breekt door ten koste van de Kromme Rijn.
840:Door de ramp, maar ook door de twisten tussen Lodewijk en zijn zoons neemt de Karolingische macht in de Nederlanden verder af. In een poging de aanvallen van de Vikingen te weren, beleent Lotharius I de Deense broers Rorik en Harald met Friesland.
843:De strijd tussen de drie zonen van Lodewijk wordt besloten met het Verdrag van Verdun, waarbij de deling van het Frankische Rijk wordt vastgelegd en het rijk der Franken in drieen wordt gedeeld. Het grootste deel van de Lage Landen komt bij het Middenrijk van keizer Lotharius. Vlaanderen komt bij het Westfrankische rijk van Karel de Kale. De Schelde wordt grens.
855:Met het Verdrag van Prum wordt ook het Middenrijk in drieen gedeeld, waarbij Lotharius II het noordelijke deel krijgt, het koninkrijk Lotharingen. Na het overlijden van de kinderloze Karel van Provence in 863 worden diens bezittingen verdeeld onder zijn twee broers.
870:Na het overlijden van de volgens de wet kinderloze Lotharius II in 869 wordt zijn rijk verdeeld in het Verdrag van Meerssen. Zijn ooms, Karel de Kale en Lodewijk de Duitser, respectievelijk de koningen van West- en Oost-Francie, verdelen de nalatenschap van Lotharius II. In Lotharingen wordt de grens tussen het Franse en Duitse koninkrijk gevormd door de loop van de rivieren de Maas, de Ourthe en de Moezel. Italie en Bourgondie worden bij het Duitse Rijk gevoegd.
878:In Engeland worden de Vikingen onder Guthrum in de Slag bij Edington verslagen door Alfred de Grote. Een deel van de Vikingen steekt over naar Vlaanderen en teistert de kust.
880:De aanvallen van de Vikingen hebben het Frankische gezag ondermijnd - Friesland is bijvoorbeeld in Deense handen - en als Bosso van Provence, een edele die niet van Karolingische afkomst is, zich laat uitroepen tot koning van de Provence, besluiten de Duitse koning Lodewijk de Jonge en de koningen van Frankrijk Lodewijk III en Karloman van Frankrijk tot het Verdrag van Ribemont, waarmee een einde komt aan de rijksdelingen. Lotharingen komt bij het Oost-Frankische rijk en men probeert het daarin te integreren.
881:Waarschijnlijk na uit Engeland verdreven te zijn, wordt Godfried de Noorman door Lodewijk III van Oost-Francie beleend met Friesland. In hetzelfde jaar wordt Maastricht geplunderd door de Vikingen. Een jaar later vindt de belegering van Asselt plaats, waarna Godfried zich tot het christendom bekeert en hij de gouw Kennemerland in leen krijgt.
885:Godfried wordt opgepakt door Hendrik van Babenberg en om het leven gebracht vanwege zijn aandeel in het complot met Hugo, de broer van Gisela, tegen Karel de Dikke. De Fries Gerolf is bij de terechtstelling betrokken en wordt in 889 beleend met Kennemerland en het gebied rond Tiel. Gerolf wordt wel gezien als de stamvader van het Hollandse huis, al worden tot plusminus 1100 de bewoners van zijn gebied nog Friezen genoemd.
896:Koning Zwentibold verleent Tiel, Utrecht en Deventer speciale handelsprivileges.
911:Lodewijk het Kind overlijdt. Hij was de laatste Karolinger in Oost-Francie, maar er is geen sprake van dat de Karolingse West-Frankische koning Karel de Eenvoudige de macht overneemt, de rijkseenheid is voorbij. Hoewel Oost-Francie ook uiteen had kunnen vallen in de vier stamhertogdommen Franken, Saksen, Beieren en Zwaben, kiezen de rijksgroten Koenraad, de hertog van Franken, die echter alleen over zijn eigen gebied reele macht heeft. In Lotharingen kiest men er echter wel voor om zich onder Karel de Eenvoudige te scharen.
922:Karel de Eenvoudige schenkt Dirk I op 15 juni de kerk van Egmond met alle daarbij behorende goederen als dank voor zijn steun bij een opstand van zijn vazallen. Egmond ligt ten noorden van de bezittingen die hij van Gerolf heeft gekregen en sluit daar dus uitstekend op aan. Kort hierna sticht hij er de Abdij van Egmond.
922:Historische kaart 919-1125
925:De Saksische vorst Hendrik de Vogelaar is koning van Duitsland geworden en trekt al spoedig ten strijde. Na in 922 Karel de Eenvoudige al uit Lotharingen te hebben gedreven, verovert Hendrik de Vogelaar ook Holland, Kennemerland en Texel als onderdeel van Lotharingen. De band van de Nederlanden met het Duitse rijk zal officieel tot 1648 blijven bestaan.
