1653:In maart weet commandeur Jan van Galen de Engelse Middellandse Zeevloot te verslaan in de Slag bij Livorno. Door het Nederlandse bondgenootschap met de Denen kan geen enkel Engels schip de Oostzee in, zodat de Engelsen een tekort hebben aan timmerhout en teer. De oorlog is echter kostbaar voor de Republiek, terwijl de kansen keren voor de Engelsen. In maart winnen zij de Driedaagse Zeeslag, terwijl Zeeslag bij Nieuwpoort van de 12e tot de 13e juni voor de Republiek catastrofaal uitpakt met een blokkade van de Nederlandse kust. Tromp sneuvelt in de Slag bij Ter Heijde, waardoor de Nederlandse publieke opinie zich tegen de oorlog keert. Ondanks de successen zijn echter ook de Engelsen aan het eind van hun Latijn. Vanaf de zomer zijn er geen vijandelijkheden meer.
1653:Johan de Witt wordt raadpensionaris van Holland. Deze benoeming kan alleen geschieden met de nadrukkelijke instemming van Amsterdam, dat onder leiding staat van burgemeester Cornelis de Graeff, de meest succesvolle Amsterdamse burgemeester uit de Gouden Eeuw, van wie De Witt een aangetrouwde neef is. De voorbeeldige samenwerking tussen de twee politici is een grote factor in het succes van De Witts politiek en de herleving van de economie na de Eerste Engels-Nederlandse Oorlog.
1653:Gezicht op Olinda, Brazilie (Frans Post, 1662)
1654:Door de oorlogsinspanningen is de Republiek niet in staat Nederlands-Brazilie te behouden en wordt verdreven door de Portugezen.
1654:Op 22 april keuren de Staten-Generaal het vredesverdrag met Cromwells Gemenebest goed. In het geheim is echter bedongen is dat de Oranjes geen stadhouder meer mogen worden. Op 4 mei nemen de Staten van Holland nemen deze Akte van Seclusie (Uitsluiting) aan, waarin de vierjarige Willem van het stadhouderschap uitgesloten wordt. Vooral in Friesland is er grote verontwaardiging. De andere gewesten - behalve Zeeland - zijn zeer verdeeld. Hoewel de buitenlandse inmenging in de opvolging vernederend is, komt het De Witt niet slecht uit.
1654:Het kasteel van Batavia, gezien van Kali Besar West, ~1656, Andries Beeckman.
1654:Het melkmeisje (Johannes Vermeer, ca 1660)
1654:Het verbranden van de Engelse vloot bij Chatham, juni 1667, tijdens de Tweede Engelse Zeeoorlog (1665-67) (Willem Schellinks,1667-68)
1654:Allegorie op de bloei van de Nederlandse visserij na de Tweede Engelse Zeeoorlog (1665-67) (Willem Eversdijck, ca 1667). Het schilderij, met verschillende Nederlandse admiraals (o.a. Adriaen Banckert en Michiel de Ruyter), waarvan enkelen een net met vis binnenhalen, benadrukt het belang van de visserij
1655:De Witt en Willem Frederik komen tot een vergelijk. Willem Frederik mag opperbevelhebber van het leger worden, maar hij moet ophouden zich luitenant-stadhouder van Overijssel te noemen. Daarmee erkent hij in feite de Akte van Seclusie.
1655:Christiaan Huygens ontdekt Titan, de grootste maan van Saturnus.
1655:In Amsterdam wordt na zeven jaar bouwen het stadhuis op de Dam in gebruik genomen.
1656:De Republiek stuurt een vloot naar Danzig onder Obdam, om te verhinderen dat de stad in Zweedse handen valt.
1656:Rembrandt wordt failliet verklaard. Zijn kunstverzameling, atelierspullen en huis worden aan de schuldeisers verkocht.
1656:Spinoza wordt uit de sefardische gemeente verbannen.
1657:Er heerst al sinds 1653 een burgeroorlogachtige toestand in Overijssel. Hasselt en Steenwijk willen ook een stem in de Staten en rebelleren tegen Zwolle, met steun van Deventer. Hasselt wordt drie dagen gebombardeerd en Deventer stuurt versterkingen. Een commissie van de Staten-Generaal wordt gevormd op aandringen van Holland. De Witt en de Graeff maken een eind aan de Overijsselse troebelen. De klok wordt teruggedraaid. Hasselt en Steenwijk krijgen geen gelijk.
1657:De Republiek verklaart de oorlog aan Portugal omdat dat land geen schadevergoeding voor het verlies van Brazilie wil betalen. De vloot onder Obdam blokkeert de haven van Lissabon.
1657:De VOC voltooit de verovering van Portugees Ceylon.
1658:De Zweeds-Nederlandse oorlog is een interventie in de Vierde Noordse Oorlog tussen Zweden en Denemarken, waarbij de Republiek de Denen steunt. Tijdens de Slag in de Sont weten de Nederlanders de Zweden te verslaan en Kopenhagen te ontzetten.
1659:De Engelsen sturen een vloot om de Zweden te steunen. Een tweede Nederlandse vloot onder Michiel de Ruyter wordt erachteraan gestuurd om de Denen te versterken. De politiek van De Witt om de vloot uit te breiden blijkt succesvol als men de Sont open weet te houden.
1660:In Engeland is door een opstand van generaal Monck het bewind van Cromwell omvergeworpen en is Karel II aan de macht gekomen. Om hem gunstig te stemmen wordt de Akte van Seclusie ingetrokken.
1661:De weduwe van Willem II, Maria Stuart, overlijdt. De regenten in de Republiek gaan er niet mee akkoord dat het voogdijschap over haar zoon Willem toegewezen wordt aan haar broer haar broer Karel II van Engeland. Uiteindelijk neemt Amalia van Solms in september de voogdijschap van haar kleinzoon op zich.
1661:Karel II kondigt opnieuw, nu in zijn eigen naam, de Akte van Navigatie af. Hij benoemt Sir George Downing, bekend om zijn anti-Hollandse houding, tot ambassadeur. Degenen die gehoopt hadden op betere betrekkingen met Engeland scharen zich nu weer achter de Johan de Witt.
1661:De Engelsen proberen te verhinderen dat Portugal vrede sluit met de Republiek, maar de Staten-Generaal neemt de Vrede van Den Haag toch aan, met Zeeland en Gelderland tegen.
1661:Er komt eindelijk een overeenkomst tussen de Republiek en Spanje over de landen van Overmaas, de streek rond Maastricht. Door het Partagetractaat wordt de streek gedeeld.
1661:De eerste minister van Frankrijk, kardinaal De Mazarin, sterft, waarna Lodewijk XIV persoonlijk de macht op zich neemt. Met de opstand, la Fronde, achter de rug, weet Lodewijk Frankrijk tot absolute monarchie te vormen. Lodewijks minister Colbert slaagt erin de economische slagkracht van Frankrijk aanzienlijk te verbeteren ten opzichte van de twee belangrijkste concurrenten, Groot-Brittannie en de Nederlanden. Frankrijk is een van de machtigste staten van Europa en voert een expansionistische politiek.
1662:De Nederlanders in Fort Zeelandia geven zich over aan Koxinga, waarmee een einde komt aan bijna veertig jaar Nederlandse handelsmacht op Formosa (Taiwan).
1662:De welvaart in de Hollandse republiek bereikt een hoogtepunt. Amsterdam is uitgegroeid tot de belangrijkste handelsstad in de wereld en heeft meer dan 100.000 inwoners.
1664:Buiten Europa is er voortdurende strijd met de Engelsen. Zij veroveren Curacao, Nieuw-Amsterdam en de factorijen op de West-Afrikaanse kust, wat aanleiding is voor de Nederlanders om Michiel de Ruyter naar deze gebieden te sturen, die de laatste prompt herovert. De Engelsen maken zo'n 200 Nederlandse koopvaarders buit. Ook de Engelse Scheepvaartwetten zijn nog steeds een doorn in het oog van de Nederlanders.
1665:In maart breekt de Tweede Engelse Oorlog uit. Afgezien van Munster en Portugal sympathiseren de meeste Europese machten met de Republiek, maar houden zich erbuiten. De Slag bij Lowestoft op 13 juni is een Engelse overwinning, waarna de Engelsen een jaar lang de zee beheersen, maar deze weten deze situatie niet uit te buiten doordat de Ruyter verschillende retourvloten veilig thuisbrengt en Lodewijk XIV zich aan de kant van de Republiek schaart, die haar vloot met een ambitieus nieuwbouwprogramma versterkt.
1665:Het Nederlandse Korps Mariniers wordt op 10 december opgericht.
1665:Anthoni van Leeuwenhoek slijpt zijn eigen lenzen en bouwt een microscoop en ontdekt daarmee microscopische diertjes.
1665:Bernhard von Galen, bisschop van Munster, belegert Groningen.
1666:Na de Nederlandse overwinning in de Vierdaagse Zeeslag (11 - 14 juni) lijkt het er even op dat Engeland al verslagen is, maar tot ieders verrassing kan het toch opnieuw een vloot uitrusten die sterk genoeg is om op 4 augustus in de Tweedaagse Zeeslag bij North Foreland de Nederlandse vloot aan de rand van de afgrond te brengen. De Republiek begint geldgebrek te krijgen, wat nog verergerd wordt door een Engelse raid die een handelsvloot op het Vlie verwoest.
1667:De kosten van het herstel van de Engelse vloot in juli hebben ook Karels financien totaal uitgeput; hij beeindigt liever de oorlog dan nog meer macht af te staan aan het parlement. Hij legt dus de dure linieschepen van zijn vloot op en begint vredesonderhandelingen. De Republiek, die voldoende reserves heeft om haar vloot voor een derde maal gevechtsklaar te maken, acht het echter beter om de oorlog met een duidelijke overwinning af te sluiten en vernedert de Britten met de Tocht naar Chatham. Met de Vrede van Breda wordt de oorlog uiteindelijk afgesloten. De vrede wordt als gunstig voor de Republiek gezien. De Engelse Scheepvaartwetten worden versoepeld, terwijl Nieuw-Amsterdam voorlopig in Engelse handen blijft en het meer renderende Suriname Nederlands bezit zal zijn: de status quo blijft bij deze gebieden dus gehandhaafd, hoewel er nog geen definitieve beslissing over wordt genomen.
1667:Lodewijk XIV verscherpt de tarieven tegen de Nederlandse handel en valt de Spaanse Nederlanden binnen.
1667:In het Verdrag van Bongaja erkent de sultan van Tidore het handelsmonopolie van de Verenigde Oostindische Compagnie.
1667:Willem wordt in 1666 tot Kind van Staat verklaard, zodat de overheid pro-Engelse elementen uit zijn omgeving kan verwijderen. Het Eeuwig Edict wordt daarna aangenomen in de Raad van Leiden. Daarin wordt het stadhouderschap voor altijd afgeschaft, en wordt gesteld dat de soevereiniteit niet bij de Unie, de prins of zelfs maar bij de Staten van het gewest ligt, maar bij de individuele steden.
1667:Nederlandse schepen op de rede van Texel; in het midden de 'Gouden Leeuw', het vlaggeschip van Cornelis Tromp (Ludolf Bakhuysen, 1671)
1668:Nederland gaat de Triple Alliantie aan met Zweden en Engeland tegen Frankrijk die tot doel heeft een einde te maken aan het conflict tussen het verzwakte Spanje en de sterke Zonnekoning in de Spaanse Nederlanden. De Alliantie sommeert Spanje om of Luxemburg of de Vrijgraafschap (Franche-Comte) af te staan plus alle al veroverde gebieden (Douai, St. Omer, Rijsel en Kamerijk). Frankrijk moet daarmee genoegen nemen en de Devolutieoorlog staken.
1670:Het geheime Verdrag van Dover tussen Karel II van Engeland en Lodewijk XIV van Frankrijk wordt afgesloten. Karel belooft hierbij zichzelf en Engeland te bekeren tot het katholicisme en de Triple Alliance te verlaten. Engeland wordt dan bondgenoot van Frankrijk in zijn oorlog met de Republiek.
1670:Spinoza geeft zijn Tractatus Theologico-Politicus uit. Hij stelt daarin dat democratie van alle regeringsvormen degene is die het meest natuurlijk is en het meest in samenklank met de individuele vrijheid.
1670:Lodewijk XIV trekt bij het Tolhuis bij Lobith de Rijn over, 12 juni 1672 (Adam Frans van der Meulen)
1670:De lijken van de gebroeders De Witt, opgehangen op het Groene Zoodje aan de Vijverberg te Den Haag, 1672 (toegeschreven aan Jan de Baen)
-1672:In maart Engeland verklaart de Republiek de oorlog, de Derde Engelse Oorlog.
-1672:In april verklaren ook Frankrijk, en de bisdommen Munster en Keulen de Republiek de oorlog, het begin van de Hollandse Oorlog. De binnengevallen legers verslaan het zwakke leger van de Republiek en rukken op van de IJssel tot in Utrecht. Door deze tegenslagen breekt paniek uit in de niet bezette delen van de Republiek. Veel bestuurders die aan de kant van de tot dat moment leidende partij van de staatsgezinden staan, worden gedwongen hun posities af te staan aan prinsgezinden. Dit jaar vormt zo ook het eind van het Eerste Stadhouderloze Tijdperk.
-1672:Raadspensionaris van Holland Johan de Witt, de belangrijkste staatsman van dat moment, wordt samen met zijn broer Cornelis de Witt, lid van de Staten-Generaal, in Den Haag door een woedende menigte gelyncht. Dit gebeurde bij de Gevangenpoort, waar Cornelis zojuist gevangen is gezet wegens een vermeende beraming van een moordaanslag op Willem III. Die wordt met steun van de Oranjepartij tot stadhouder benoemd.
-1672:In Utrecht beginnen onderhandelingen over vrede. Frankrijk zal de gebieden ten zuiden van de Waal krijgen, Engeland Walcheren en enkele steden aan de kust en Keulen en Munster wat gebied in het oosten. Karel en Lodewijk zien Willem III als prins regeren over het overblijfsel van de Republiek. Ook moet er veel geld worden betaald en de katholieken volledige godsdienstvrijheid worden gegeven, anders zal Frankrijk Utrecht en heel Gelderland houden. Deze eisen zijn zo hoog dat ze afgewezen worden en sterken de Republiek in haar verzet. Tijdens de onderhandelingen is Willem III erin geslaagd zich terug te trekken achter de Waterlinie. Dit enorme gebied is onder water gezet waardoor de Franse opmars vastloopt. De Nederlandse vloot heeft ondertussen de verenigde Engels-Franse vloot verslagen in de Slag bij Solebay, waarmee een invasie van de kust voorkomen is en de bisschop van Munster Bernard von Galen ziet zich op 28 augustus gedwongen om het beleg van Groningen op te breken.
-1672:Lodewijk XIV tijdens het Beleg van Maastricht (1673)
1673:Op het diplomatieke front slaagt de Republiek erin om het Heilige Roomse Rijk, Lotharingen en Spanje aan haar zijde te krijgen, de Quadruple Alliantie, vanaf juli 1673 aangevuld met Brandenburg. Bonn wordt veroverd, waarmee de Fransen hun aanvoerpunt verliezen. Om een andere verbindingslijn op te bouwen, slaan de Fransen het Beleg van Maastricht, dat zij ook veroveren.
1673:De Eerste en Tweede Slag bij het Schooneveld en de Slag bij Kijkduin worden gewonnen door Michiel de Ruyter, waarna Engeland zich terugtrekt uit de strijd.
1674:Met Engeland wordt de Tweede Vrede van Westminster gesloten, Keulen en Munster sloten in 1674 vrede, de Franse koning vecht door. Gelderland, Overijssel en Utrecht herkrijgen hun zitting in de Staten-Generaal, ondanks hun ontrouw en tegenstand van Holland, maar moeten daarvoor trouw zweren aan Willem III en voldoen aan een aantal regeringsreglementen, waardoor Willem III een beslissende invloed op die gewesten krijgt en daarmee meer macht dan zijn voorgangers.
1674:De Staten Generaal verklaren het stadhouderschap erfelijk voor de nakomelingen van Willem III.
1674:Antoni van Leeuwenhoek (Jan Verkolje)
1674:Adriaan van Beverland (1651-ca.1712). Schrijver van theologische werken en hekelschriften, met een dame van lichte zeden (Ary de Vois, 1678)
1677:Spinoza overlijdt, waarna zijn levenswerk Ethica ordine geometrico demonstrata door vrienden wordt uitgegeven. Het leidt tot heftige debatten en na enkele maanden wordt een verbod op publicatie uitgevaardigd door de Staten van Holland, wat de verspreiding van zijn geschriften echter niet stopt.
1678:Met de Vrede van Nijmegen komt een einde aan de oorlog met Frankrijk, tegen de zin van Willem III, die de rest van zijn leven tegen het Franse streven naar hegemonie strijdt.
1679:Antoni van Leeuwenhoek ontdekt met zijn zelfgemaakte microscoop de zaadcel. In 1680 wordt hij lid van de Royal Society.
1679:Interieur van de Portugese synagoge te Amsterdam (Emanuel de Witte, 1680)
1680:Lodewijk XIV verklaart de Republiek de oorlog.
1685:Als Karel II van Engeland overlijdt, wordt hij opgevolgd door Jacobus II, de schoonvader van Willem III. Als katholiek wordt hij gewantrouwd, maar aangezien hij geen mannelijke erfgenamen heeft, is zijn protestantse dochter Maria troonopvolgster, zodat het probleem overkomelijk lijkt.
1685:In zijn twist met Louis Paen blijkt Menno van Coehoorn het laatste woord te hebben als hij zijn boek Nieuwe vestingbouw op een natte of lage horisont uitbrengt. In dit boek worden drie methodes van vestingbouw omschreven die speciaal zijn ontworpen voor het Nederlandse landschap en die de modernste manieren van oorlogsvoeren zouden kunnen weerstaan.
1686:Keizer Leopold I sluit op advies de Liga van Augsburg met Karel II van Spanje, Karel XI van Zweden, Maximiliaan II van Beieren en diverse andere rijksstenden tegen Frankrijk.
1688:Met het Edict van Fontainebleau (1685) herroept Lodewijk XIV van Frankrijk het Edict van Nantes en verklaart het protestantisme onwettig. Daarop vluchten 400.000 hugenoten naar protestantse landen als Engeland, Brandenburg, Zwitserland en zelfs Zuid-Afrika. Naar de Republiek vluchten zo'n 70.000 hugenoten naar Nederland. Daarmee schaadt Lodewijk zijn eigen land, aangezien een aanzienlijk deel goed is opgeleid en zich nu tegen Frankrijk richt. Daarnaast zien de protestantse buurlanden nu duidelijk de gevolgen van een eventuele Franse overheersing, zodat de vastberadenheid daartegen alleen maar toeneemt.
1688:Op 10 juni schenkt de tweede vrouw van Jacobus II, Maria d'Este, het leven aan haar vijfde kind, ditmaal een zoon, Jacobus. De algemene ontevredenheid neemt met de geboorte van deze katholieke erfgenaam nog meer toe. Het vooruitzicht van een katholieke dynastie is zeer bedreigend voor de protestanten, die niet gelukkig zijn met een katholiek als hoofd van de Kerk van Engeland. Dit leidt tot een samenzwering, de Glorious Revolution, met het doel James te vervangen door zijn dochter Maria, overtuigd protestante. Op 5 november landt Maria's echtgenoot Willem III in Engeland bij Torquay met een groot Nederlands leger. De armada van Willem is, met 53 oorlogsschepen en een kleine 400 transportschepen, zo'n vier keer groter dan de Spaanse Armada van 1588. Willem geeft het bevel het Engelse leger te ontbinden en daar wordt goeddeels gehoor aan gegeven. Jacobus heeft daardoor al snel in Engeland zelf niet veel steun meer. Op 11 december vlucht hij, om vanuit die delen van zijn rijk waar hij nog wel steun heeft - het katholieke Ierland - de strijd voort te zetten.
1688:Lodewijk XIV valt in september de Palts binnen en bezet het prinsbisdom Luik. Het is het begin van de Negenjarige Oorlog.
1689:William & Mary aanvaarden de Bill of Rights en laten hiermee officieel hun koningschap beginnen.
1689:Met Willem als stadhouder van de Republiek en koning van Engeland vormen deze landen met de Liga van Augsburg de Grote Alliantie tegen Frankrijk. Ondanks deze bundeling van krachten heeft men moeite Frankrijk te bedwingen.
1689:De slag aan de Boyne (Ierland) tussen Jacobus II en Willem III, 12 juli 1690 (Jan van Huchtenburg)
1690:Op 12 juli vindt de Slag aan de Boyne plaats. Tegenover elkaar staan de legers van de koning-stadhouder Willem III en zijn schoonvader, de verdreven koning Jacobus II van Engeland. De overwinning van Willem III maakt een einde aan de aspiraties van Jacobus om zijn troon te heroveren. De zege van Willem wordt in Noord-Ierland jaarlijks herdacht op 12 juli. Op die dag vinden dan marsen plaats waarbij de leden van de Oranjeorde de overwinning vieren van de protestantse King Billy over de katholieke Jacobus.
1691:De afgezette predikant van Amsterdam, Balthasar Bekker, schrijft het boek De Betoverde Weereld, waarin hij zich afzet tegen het wijd verbreide geloof in heksen en duivels. In de Republiek ontstaat een heftig dispuut tussen mede- en tegenstanders. Uiteindelijk leidt het boek tot uitbanning van de heksenvervolging, al zal dit meer gelden voor andere landen in Europa, want in de Republiek komt dit al lange tijd niet meer voor.
1693:Willem III verliest de Eerste Slag bij Neerwinden, de bloedigste van deze eeuw.
1695:Christiaan Huygens overlijdt. De wis-, natuur-, sterrenkundige en uitvinder was een van de eerste statistici en geldt als de uitvinder van het slingeruurwerk. Hij formuleerde onder andere botsingswetten in de mechanica, ontdekte de ringen van Saturnus en de maan Titan bij deze planeet en kwam als eerste met de golftheorie voor het verschijnsel licht.
1696:Tijdens het aansprekersoproer wordt door de schutterij op de bevolking van Amsterdam geschoten. Het huis van de burgemeester Jacob Boreel wordt vernield.
1697:De Grote Ambassade van Peter de Grote arriveert in Zaandam. De tsaar volgt een stage in de scheepsbouw en logeert bij burgemeester en scheepsbouwkundige Nicolaes Witsen waarmee hij al lange tijd correspondentie voert.
1697:Met de ondertekening van de Vrede van Rijswijk, bewerkstelligd door Bentinck, komt een einde aan de Negenjarige Oorlog. Lodewijk XIV van Frankrijk erkent Willem III als koning van Engeland en moet alle veroveringen op Spanje ongedaan maken. De Republiek krijgt het recht om in zogenaamde barrieresteden in de Spaanse Nederlanden militairen te legeren. Frankrijk mag Straatsburg houden, maar moet de zelfstandigheid van het hertogdom Lotharingen respecteren. Frankrijk blijft de grootste mogendheid van Europa en een rivaal voor de Duitse keizer Leopold bij diens aanspraken op de Spaanse troon, waarmee de volgende oorlog zich alweer aftekent. De Republiek heeft haar taak als grootmacht volbracht door te vechten voor een Europees evenwicht, maar de oorlog kost meer dan deze opbrengt voor de stagnerende economie.
1697:Trompe l'oeil (Edwaert Collier, ca 1699). Trompe-l'oeil - bedrieg het oog of gezichtsbedrog - is een populaire schildertechniek in de Gouden Eeuw
-1:Na de dood van de kinderloze en lichamelijk en geestelijk gehandicapte Karel II van Spanje ontstaat er onzekerheid over de Spaanse opvolging. Het testament van Karel II wijst Filips van Anjou als opvolger aan, maar onder de voorwaarde dat de Spaanse en Franse kronen nooit verenigd zouden worden. Het lijkt erop dat de andere mogendheden daar genoegen mee nemen.
1701:Lodewijk XIV eist toch een vereniging van de Franse en Spaanse kronen en er begint oppositie te komen van de keizer die op zijn beurt de erfenis van Spanje voor het huis Habsburg opeist. Dit leidt tot de Spaanse Successieoorlog.
1702:Willem III overlijdt. De Staten van Holland en Zeeland hebben stadhouderschap erfelijk verklaard voor de nakomelingen van Willem III, en aangezien deze geen nageslacht heeft, wordt besloten af te zien van benoeming van een opvolger, wat het begin is van het Tweede Stadhouderloze Tijdperk, hoewel in Friesland en Groningen Johan Willem Friso stadhouder is. Deze erft de titel Prins van Oranje. Echter, direct na het openvallen van het testament maken ook de Fransman Frans Lodewijk van Conti en Frederik I van Pruisen aanspraak op de titel.
1702:In mei voegt de Republiek zich bij de Grote Alliantie tegen Frankrijk in de Spaanse Successieoorlog.
1702:In de Gelderse Plooierijen proberen de gilden en de regentenfamilies die onder Willem III van de macht waren uitgesloten meer politieke invloed te krijgen. Zij worden Nieuwe Plooi genoemd, de zittende regenten Oude Plooi. Dit leidt in de periode 1702-1708 niet alleen tot grote ongeregeldheden in de steden Arnhem, Nijmegen en Zutphen, maar ook in kleinere steden.
1703:De plooierijen beperken zich niet alleen tot Gelre, ook Utrecht en Overijssel worden getroffen door deze oproeren, echter niet zo hevig als in Gelre.
1705:Nicolaus Cruquius begint in Delft driemaal daags weermetingen uit te voeren: temperatuur, luchtdruk, vochtigheid en neerslag.
1705:Plantage in Suriname (Dirk Valkenburg, 1707)
1708:Engeland weigert een voor de Republiek gunstige vrede.
1709:Herman Boerhaave wordt hoogleraar in Leiden. De arts, anatoom, botanicus, scheikundige, humanist en onderzoeker bekleedt een tijdlang drie van de vijf leerstoelen van de medische faculteit. Hij staat bekend als begenadigd docent en is een van de bekendste mannen van Europa, wiens faam zelfs tot in China doorgedringt.
1710:Op grond van de hopeloze verarming van de kolonie geeft de VOC Mauritius op, ditmaal voorgoed. Gouverneur van der Velde geeft opdracht het eiland te ontruimen.
1711:Keizer Jozef I, aartshertog van Oostenrijk, overlijdt. Hij wordt opgevolgd door zijn broer Karel VI. Om te voorkomen dat hij tevens koning van Spanje wordt en dan een te groot en te machtig rijk krijgt starten de Engelsen onderhandelingen.
1713:Op 11 april wordt de Vrede van Utrecht getekend. Met de Vrede van Utrecht komt er een einde aan de Spaanse Successieoorlog. Hoewel de onderhandelingen een jaar lang in de Nederlanden plaatsvinden, komt de Republiek er nauwelijks aan te pas. In de woorden van de Franse onderhandelaar Melchior de Polignac; Nous traiterons sur vous, chez vous, sans vous, We onderhandelen over u, bij u, zonder u. Duidelijk is dat de Republiek vanaf nu als een tweederangsgrootmacht wordt beschouwd. Hoewel aan de kant van de overwinnaars, verliest de Republiek zijn overwicht op zee en de Zuidelijke Nederlanden komen aan de Oostenrijkse Habsburger Karel VI als erfgenaam van de Spaanse Habsburgers. Wel mogen Staatse garnizoenen worden gelegerd in acht steden van de Oostenrijkse Nederlanden als bescherming tegen de Fransen. Ook bekrachtigt de Vrede van Utrecht de soevereiniteit van Frankrijk over het prinsdom Oranje en wijst wapen en titel van Oranje toe aan Pruisen. De enige territoriale winst bestaat uit de inlijving van Venlo.
1713:Vanaf 1672 is de Republiek veertig jaar bijna onafgebroken in oorlog geweest met Frankrijk. De schuldenlast van Holland, dat het grootste deel van de last draagt, is dusdanig hoog dat 70 procent van het inkomen opgaat aan de betaling van rente.
1715:De voorwaarden voor de legering van Staatse garnizoenen in de Oostenrijkse Nederlanden worden geregeld in het barrieretractaat, getekend op 15 november. De Oostenrijkse Nederlanden worden militair gezien in zekere zin een condominium tussen de keizer en de Republiek.
1716:De moeizame bestuursvorm van de Republiek met de grote macht van de gewesten en steden maakt dat noodzakelijke hervormingen niet tot stand komen. Simon van Slingelandt pleit gedurende de een jaar durende Tweede Grote Vergadering voor een sterker centraal gezag onder de Raad van State. Vooral door gebrek aan steun uit Holland blijft dit zonder resultaat en houdt men vast aan de gewestelijke autonomie.
1716:Het Groote Tafereel der Dwaasheid, 1720
1720:Met het Verdrag van Den Haag komt een einde aan de Oorlog van de Quadruple Alliantie.
